Reviews,description_lengths
"I was impressed with the scope of this novel - from Japan to Pakistan to America, and covering about half a century - it touched upon a broad spectrum of cultures, politics and lives, with the twists and turns in the story largely governed by geographic location. For me it was all about identity, and how a sense of identity can be damaged by the horror of an atomic bomb, or by failing exams, by subterfuge, or by looking different to those around you. But as well as exploring alienation, this book explores the wonderful ties that bind people together. The loves, the loyalties and the unavoidable ambivalence that makes up the knots that keep us together.Several people in this book have the world opened up to them via their extraordinary gifts with languages, and reading this as a monoglot I was extremely envious. This is my fantasy, an effortless learning whereby new languages simply fall into your lap, and you are able to take off to new lands or explore new cultures, with a vast chunk of you being already at home in these new places. Friends teaching friends, mother teaching son, seemingly almost by osmosis. Yeah, I was envious.I also liked the fact that I learnt a lot from this book. We didn’t spend enough time in any one culture to be utterly immersed in it, but we touched upon some fascinating experiences – what it was like to be a German in Japan during the second world war, what it was like to be an educated Indian servant to a British family, what it was like to be in Pakistan and Afghanistan - supporting the mujahidean, what it was like to be on the run (both in Afghanistan and America), and what it was like to be a Muslim in New York after 9/11. It was most rewarding to have these experiences opened up to me.My one criticism is that some of the relationships felt a bit forced, almost too good to be true, also sometimes people’s lives seemed to take an unnecessary negative twist....almost on a whim. I felt like jogging the author’s elbow a couple of times. Having said that, most of the people in this book were beautifully evoked, their characters drawn with exquisite sensitivity, often via dialogue. All in all I found this book both moving and gripping. An excellent read.",402
"This has quickly become one of my favourite books of all time. It's an important and beautifully written read, give it a chance. ",24
"It is a saga of two families whose lives are inextricably intertwined. It is an epic tale sweeping across continents over a sixty-year period. Burnt Shadows by Kamila Shamsie begins in Nagasaki on August 9, 1945; goes to India just before partition in 1947; to Pakistan in 1982-1983; and concludes in New York and Afghanistan in 2001-2002. The central figure is Hiroko Tanaka, a Nagasaki resident. The novel opens with her as a twenty-one-year-old and engaged to a man of English and German descent. When the atomic bomb is dropped on Nagasaki, Hiroko loses her fiancé and her father. In addition to her emotional and psychological scars, Hiroko carries disfiguring burn scars on her back. Having lost everything in Nagasaki, she decides to make a clean break. She visits her fiancé’s half-sister, Elizabeth Weiss, who lives in India with her husband, James Burton. There she meets and marries Sajjad Ashraf, a Muslim employed by the Burtons. The partition in India forces the newly-weds to relocate temporarily to Istanbul then to Pakistan which they call home for nearly twenty years until Sajjad’s untimely death. Hiroko then relocates to New York to live with Elizabeth. The ties connecting the Tanakas, the Ashrafs, and the Burtons extend to their respective children, Henry Burton and Raza Ashraf, and to Henry’s daughter, Kim Burton.Shamsie skillfully infuses the different time frames and locations with historical and political events. Through Hiroko’s eyes, we see Nagasaki in the aftermath of the atomic bomb. We see the escalating tensions in India between British colonists, Hindus, and Muslims. From neighboring Pakistan, we see Afghanistan’s armed struggle against Russian occupation. And in New York, we see the aftermath of 9/11. Set against the backdrop of global conflicts over a period of nearly sixty years, this family saga wrestles with a number of complex issues. Scenes throughout reveal cross-cultural conflicts, racism, cultural understanding, cultural arrogance, ethnocentrism, loyalty, sacrifice, family, othering, betrayal, and the displacement of a civilian population. The four sections are seamlessly woven together with transitional passages to explain the leaps in time and location. The characters are unique, believable, and speak in authentic voices. Shamsie’s portrayal of Hiroko is particularly effective. She emerges as independent, loving, strong, tender, adaptable, and the anchor which binds the narrative and families together. Her fluency in several languages illustrates how language facilitates understanding and appreciation of a culture. But fluency in languages and dialects can also have catastrophic consequences, as evidenced by Raza. Having inherited his mother’s language skills, Raza sets in motion a series of events which end tragically. Hiroko’s character also contrasts racism with acceptance of the other. When Kim Burton seeks understanding for reporting an Afghan Muslim to authorities solely on the basis of a shared religion with the 9/11 terrorists, Hiroko responds with, “Should I look at you and see Harry Truman?” Enough said.A very powerful and compelling novel showing the impact of global conflicts on the lives of individuals. Told with compassion and sensitivity in immersive, riveting language.Very highly recommended.My book reviews are also available at www.tamaraaghajaffar.com",533
"I read so much, and so quickly, that it takes a rare exception of a book to send me searching for post-it notes and a pen to write down quotes from the writing. I found the writing in this book so compelling, that I stopped reading everything else for two whole days and just immersed myself in the story of a woman who finds herself in the midst of several acts of war in the lifetime. From Nagasaki where she is scared mentally and physically, to Delhi where she runs with her new husband from the violence that surrounds the retreat of England, to the rise of the Taliban in Pakistan where she almost looses her son, to her retirement in New York city in 2001, where she lives with a dear old friend. There is so much that happens in this book, I really can't even begin to summarize the plot further than that.""Two years after the war, they could accept an ally of Hitler sooner than they could accept someone of a different class.""Although all those circumstances may seem contrived to put together in one book, this book was so believable, that we kept catching ourselves at my bookclub talking about the characters as if they were people we knew. But in some ways they are. We are all expats living in Asia, most of us have lived in several countries, and most of us had had cross-cultural relationships. Although we haven't directly lived in the path of war, this book is us.""We were just young and foolish, what did we know about each other? Almost nothing. It was luck, pure luck, that we discovered after marriage that our natures were so sympathetic to each other.""I don't know if a truer statement has been written about the vibe of an Asian city, ""...world's urban tribes as they enter unfamiliar landscapes of chaos and possibility.. cars using their horns in a complicated and unrelenting exchange about power, intention, and mis-trust.""",342
"A wonderful read, terrifying in parts, heart-breaking in others and beautifully written throughout - this story has had a huge impact on me and I know it will linger for a long while.From the beginning of the book when the atomic bomb is dropped on Nagasaki, the effects of this act and of war on the familes involved in the story line shows just how pointless war is.Kamila Shamsie paints some vivid pictures that are difficult to shift and often invoke high emotion.I'd highly recommend this novel",91
"This book, from the Orange Prize shortlist, has had terribly mixed reviews. How can a book that tries to tie together the bombing of Nagasaki, the partition of India, the Afghan conflict and 9/11 possibly work? Well, it does - I absolutely loved it. Hiroko is a wonderful character - she lives on the page in a way a character hasn't for me in ages, and she's the anchor that holds this enormous story together. The writing is quite beautiful - some of the imagery will really stay with me, but it really doesn't spoil the narative, quite the opposite. The moments of tenderness - her time with Konrad, the beginning of her relationship with her husband, after some of the deaths (there's a few - they make you ache with grief...) - are quite superb. The narrative thrust is sustained and ambitious - it's a blooming good story, well told. Learnt a fair bit about the politics (India/Pakistan/Afghanistan) that I didn't know before too, but in the nicest way - by slow immersion in a wonderful story. A definite 10/10 for me... ",185
