Reviews,description_lengths
"For me,it is Kamila Shamsie's second best book,after Home Fire.Not that I'd call it a great book,but it's still much better than the rest of her books.It tries to tackle too many subjects,and doesn't quite succeed.It begins with the story of a Japanese victim of the atomic bombing of Nagasaki.But if the idea was to show the destructive effects of the atomic bomb on this victim,that doesn't happen.The Japanese woman moves to India and goes through the rest of her life, without showing any ill effects.The book then goes on to include a pet peeve of Kamila Shamsie, the partition of India and the creation of Pakistan.It is a constant theme in her work as her own family had to move to Pakistan at the time of partition.Then,there are detailed descriptions of life in Karachi.It helps to fill up the pages and is also part of several of her other books.After that,she returns to international conflict once again.First comes the Soviet invasion of Afghanistan,and a Karachi young man's journey to fight the Soviets.This whole section is very superficial.Added for good measure is the story of a US agent and his daughter as well.Then comes the US invasion of Afghanistan,and that is included,as well.Again,nothing special about this part of the book.In between,the subcontinent becomes nuclearised in 1998 after India's nuclear tests and Pakistan following suit.So,the Japanese woman,already a victim of the nuclear bomb, gets scared and moves to New York.While some parts of the book were interesting,at times it felt very contrived,particularly the portion on Afghanistan.The last hundred pages,in particular were so boring that I was relieved when it finally came to an end.A good many of the situations in the book,are scarcely believeable.Too many conflicts are included,without focusing effectively on any one of them.The book essentially lacks a coherent storyline.",348
"A novel with great scope ranging over a vast sweep of modern history, written with great warmth and understanding. The characters are well drawn and believable. Characters with flaws, who make mistakes which have consequences, but who are understandable and feel like real people.The novel is broken up into three sections. The first is in the 1940s; in 1945 Hiroko Tanaka has become engaged to Konrad Weiss, a German living, like her in Nagasaki. He is killed by the atomic bomb and she is injured. Following her recovery she goes (in 1947) to India to see Konrad’s sister Ilse (Elizabeth), who is married to an Englishman, James Burton who is a lawyer and rather upper middle class. This coincides with the end of English rule and partition. Hiroko meets one of James Burton’s employees Sajjad Ashraf. They fall in love and marry; partition taking them from Dehli to Karachi. The second part moves to Pakistan in the early 1980s and the backdrop is the struggle against the Soviets in Afghanistan. The story here revolves around Sajjad and Hiroko again, their teenage son Raza and James and Ilse’s son Harry, who is working for the CIA (Ilse has left James and is now American). The final section is set just after 9/11. Harry and Raza are working together in Afghanistan for a private security company, whilst Ilse and Hioko are in New York. Harry’s daughter Kim plays a central role. A novel which seeks to encompass the dropping of the atomic bomb, the end of empire, partition, class, the cold war, the CIA supporting the mujahedeen, 9/11, the Taliban, Guantanamo Bay, terrorism, the fear of terrorism and the war in Afghanistan sets its sights high. The themes are no less impressive love, family, trust and betrayal, friendship, religion and a clash of cultures. On the whole it works rather well; intelligently written, compassionate, gripping Shamsie attempts to explain some of recent history’s more complex issues through a family saga. A couple of grumbles; the ending is flagged up too early and obviously and it really is too short. Many hefty books would benefit from being shorter. I felt this one would have stood being longer to develop the issues and some of the characters. Those are minor points; this is a competent and compassionate examination of many of the issues the modern world has to grapple with and I would recommend it.4.5 stars",412
"""Burnt Shadows"" was a gift to me from a friend who valued this book highly. It was a gift for me because it has given me much food for thought. At the outset, I was determined to enjoy this book to share the pleasure with my friend, but as I progressed I could observe why she ranked it so extremely well. I will not attempt a summary here. One can easily find that elsewhere. The scope of this novel is huge. It spans about 60 years, from the A- Bomb in Nagasaki, to the partitioning of India and Pakistan, to wartorn Afghanistan and to post 9/11 America. Shamsie has written a profound and powerful novel of family, nations and wars. Throughout this book we see the power of language, not solely as the means for communication, but as a cultural and attitudinal divide. Shamsie has deftly described scenes of racism, class division and the panorama of wars. There are wars for power, wars for religion, wars for territory or family. But what is the outcome for the people who have suffered at the hands of their invaders? In a conversation with an American woman, an Afghan man who had fought against the Soviets stated, ""...countries like yours they always fight wars, but always somewhere else. The disease always happens somewhere else.It's why you fight more wars than anyone else; because you understand war least of all."" In response to an act of apparent racial profiling, another character equates this with the concentration camps and replies, ""...you have to deny people their humanity in order to decimate them."" Shamsie has expertly drawn her characters and left the reader with a clear sense of them.It has been difficult to encapsulate this novel into a short review because it is so complex and extensive. It has made a deep impact on me, with emotions ranging from tears and sorrow to anger.",322
"'Why? Can't women travel alone in India?'Elizabeth almost laughed. So much for those demure Japanese women of all the stories she'd heard. Here was one who would squeeze the sun in her fist if she ever got the chance; yes, and tilt her head back to swallow its liquid light.Here is how to write a novel with emotional truth: find your characters, and let them make their stories. But Kamila Shamsie, who in Burnt Shadows does this so superbly, has done so much more. When I shared the opening themes of the book with my brother, who lives in Japan (I will spare readers of this review a lengthy account of all the many borders this story crossed into my own life), said, referring to the bombing of Nagasaki art is essential to capture such feelings. Even to call it essential doesn't do justice to this text, which covers such an immense ground, making a kind of sense of the world that has been terrifyingly coming into being since 1945 from the perspective of what one character, with fatal disdain, calls ordinary, little-picture morality, the spider's eye view, people and their relationships...So many novels make their protagonists suffer, but Shamsie gives Hiroko, as if to atone for making her witness the bomb, for making her lose so much, carry so much, not only competence, talent, boldness among many admirable qualities, an independent spirit (it didn't bother her in the least to know she would always be a foreigner in Pakistan - she had no interest in belonging to anything as contradictorily insubstantial and damaging as a nation) and ambiguously generous benefactors, but an extraordinarily desirable opposite number, countless sources of delight written and unwritten, a son who earns his own story, and always the last word. Frequently, in other characters' strands, we are made aware of barriers raised against women, but Hiroko always knows exactly which boundary is worthy of respect, which border may be politely or heedlessly transgressed.Language lessons and translation are the ropes, ladders, hooks, bridges of the story. In learning language, the learner thinks their way into a cultural borderland where all manner of connections are possible, where influences mix, and from where their own culture looks different. The willingness, or otherwise, to hear and understand and learn another's language, or to teach, signals the direction of a story, an emotion. James Burton tells Hiroko it's not necessary for her to learn Urdu. Kim tells an Afghan Muslim she has read the Quran in English (how often do Muslims hear this?), while he, she presumes, has never read it in a language he understands, therefore she knows better than he does what it contains. Meanwhile, Hiroko only teaches Sajjad expressions of love in Japanese, Raza enters Iran and translates flirtatious questions of the man driving him to a carful of women into Farsi, having learned it while working in Dubai. 'Why are you travelling by car?' the driver wants to know, 'don't angels fly?' but they laughingly reply that women are superior to angels. For all their noble feelings, their kind gestures, and their good intentions, the English and USians in this novel are treacherous, and these portrayals, especially, to me, of the Burtons, rang absolutely true. What was beautiful, soothing, redemptive to me in this story, was the view from elsewhere, from Hiroko and her birds, from Konrad and his optimism, from Sajjad and his family, from Raza and his friends. It doesn't have to be this way... there is no possible justification for the second bomb in a picture of any size. Things can change. Not everyone is like us.'James!' Elizabeth said, coming to stand beside her husband. 'Did you know Sajjad's family came here from Turkey seven centuries ago?''Young Turk are you?' James smiled at Sajjad.'No, Mr Burton,' Sajjad said, not understanding the reference. 'I'm Indian.' He glanced at Hiroko, who had her back to the three of them, looking up at the Arabic inscriptions on the minaret. She was offended, he knew, but what could he do about it? He looked at James, as though considering something that had never occurred to him before. 'Why have the English remained so English? Throughout India's history conquerors have come from elsewhere, and all of them - Turk, Arab, Hun, Mongol, Persian - have become Indian. If - when - this Pakistan happens, those Muslims who leave Delhi and Lucknow and Hyderabad to go there, they will be leaving their homes. But when the English leave, they'll be going home.'Hiroko turned towards Sajjad, surprised and accutely self-conscious. She had been speaking to him of Konrad's interest in the foreigners who made their homes in Nagasaki, and now she saw her words filtering into his thoughts and becoming part of the way he saw the world.'Henry thinks of India as home,', Elizabeth said, seeing how wounded James was by Sajjad's unexpected attack, and wanting to deflect it.'Yes.' There was a tightening of Sajjad's voice. 'He does.' And you sent him away because of it, he wanted to say, the sense of offence which had started as an act to impress Hiroko no longer feigned. He recalled it very well, the day her opposition to the idea of boarding school ended. He had been playing cricket in the garden with Henry when Elizabeth came out and told her son he was 'such a young Englishman'. Henry had scowled, and backed up towards Sajjad. 'I'm Indian,' he'd said. The next day James Burton had told Sajjad how relieved he was that his wife had suddenly decided to withdraw all her 'sentimental' objections to sending Henry to boarding school.'Something you want to say, Sajjad?''No, Mr Burton. Only that I don't suppose he'll continue to think of India that way for much longer.''For the best,' Elizabeth said, looking around her, feeling something that was almost sorrow to think that the descendants of the English would not come to the churches and monuments of British India seven centuries from now and say this is a reminder of when my family history and India's history entered the same stream irrevocably and for ever.'Why is it for the best?' Sajjad's voice was as near angry as anyone had ever heard it. It was hard to say if Elizabeth or Sajjad was more surprised at his tone after eight years during which he used only excessive politeness as a weapon against her. But they were both aware that this would not have happened if Hiroko hadn't been there, disrupting all hierarchies.",1120
"She had not thought of destination so much as departure, wheeling through the world with the awful freedom of someone with no one to answer to. She had become, in fact, a figure out of myth. The character who loses everything and is born anew in blood. This book is amazing. No, scratch that. Amazing is probably too weak a word here. Think Astounding. Remarkable. The kind of book you tell your best friend to read so you can discuss it together, going over all the finer points. I’ll admit, I started the book with wary suspicions. Look at that blurb. Nagasaki and the atomic bomb. 1947 and partition. 2001 and New York City and Afghanistan. The book looks like a mess waiting to happen, but. It wasn’t. In fact, it was quite miraculous how everything came together. How the lives intertwined. I have used that word quite often, but nowhere does it fit more perfectly than in this book: intertwining of fate and coincidences and relationships is a big theme in this book, and Kamila Shamsie’s canvas is the world. But let us start at the beginning.The Summary Yes, I know everything can disappear in a flash of light. That doesn’t make anything less valuable.It’s August 9, 1945, and Hiroko Tanaka, the disgraced daughter of a father who dared question the morality of children involved in Kamikaze flights, is very much in love, but with the wrong person: Konrad Weiss, a German living in Nagasaki, trying to understand their culture. In this instance, we know the bomb is going to fall, but what is more interesting is the xenophobia, the patriotism, the secrecy and the betrayals. Shamsie makes us care more about Hiroko’s mother’s death, about Konrad’s disloyal friend, about their secret love affair, than the devastation that we know is about to occur.Since her mother’s death, she had taken to interpreting the silence from her father as an absence of anything worth communicating rather than an inability to form a new configuration with his daughter now his beloved wife is no longer around to serve as the voice to his thoughts.That’s not to say that the bomb is just background noise. No, the bomb changes things, but we are now at the heart of those who suffered through it. There is no fine distance, no aloofness to be hidden behind. Shamsie is not concerned with talking about governments and politics; she wants you to look at the human who lives through war time, who survives, who has to learn to pick up the pieces later.“When the war’s over, I’ll be kind.”Fast forward to 1947 and the subcontinent, where Hiroko lands into another area full of upheaval. Going to Delhi, to the home of Konrad’s sister Ilse, now the married Elizabeth Burton, Hiroko is trying to escape the brand of Hibakusha, as hard a task as removing the bird shaped scars on her back from where the kimono she was wearing at the time of the bomb burned into her skin. Tensions in the area are chaotic with the upcoming partition into India and Pakistan, and it is here that we stumble into the world of the Burtons, a British middle aged couple, and Sajjad Ashraf, the husband James’s bored servant. It is here that, even as the outside world changes, it will be Hiroko’s presence that will cause the greatest change.She saw her words filtering into his thoughts and becoming part of the way he saw the world.Japanese, British, Hindustani. In the first half of the book, Kamila Shamsie is obsessed with nationality: which country do we come from, and how does it affect us? The Burtons, with their disintegrating marriage and their son sent out of the country because of the conflict, are as removed a part of the subcontinent as Sajjad Ashraf is in love with it. His Dilli/Dehli, where his whole family resides, is his life. He is in love with the culture, the poetry, and as reluctant to leave the city, but his blooming romance with Hiroko and the subsequent events put a twist in fate that brings us, once again, down to the level of the human reacting to the large, the international, the encompassing. It seemed to Sajjad these were the kinds of things said so that repetition made fact of conjecture. He’d know what to do with an Urdu masterpiece written by an Englishman. He’d read it. Why pretend it was more complicated than that?We move swiftly from the streets of Dilli to a pit stop in Istanbul before suddenly we’re in Karachi, the living, breathing city of Pakistan, where Shamsie’s prose shines at her best. It could be because she grew up here, but there is yearning in the writing here. If not for anything else, books like these should be read just for the breathtaking command over words, the mixing of emotion and thought and politics and culture all in one perfectly formed sentence.He cursed under his breath the government which kept trying to force religion into everything public. His mother, with her most intimate relationship with Allah, would have personally knocked on the door of Army House and told the President he should have more shame than to ask all the citizens to conduct their love affairs with the Almighty out in the open.In Karachi is where the story starts to show its desire to connect its characters. Raza Konrad Ashraf, whose very name is an amalgamation of religions and nationalities, is the book’s product of interconnectedness, Hiroko and Sajjad’s son, and Shamsie explores parenthood and adolescence like she understands what both these dual experiences can feel like. She was overwhelmed by a felling of sorrow for her boy, for that look in her eyes which told her he knew and had always known that he would have to take that most exceptional part of himself and put it to one side. She knew what Sajjad would say if she tried to discuss it with him: ‘If the greatest loss of his life is the loss of a dream he’s always known to be a dream, then he’s among the fortunate ones.’ He’d be right, of course, but that didn’t stop this pulling at her heart.Throughout the book’s course we careen throughout history, from Nagasaki to Hindustan to Karachi and then finally, inevitably, to 2001, where the shadow of 9/11 looms large over New York City and Afghanistan. It is over here that the Weiss and the Burtons will find their way into the lives of the Tanaka and Ashrafs, all the while spanning across greater demographics. We are no longer just concerned with nationalities, but with ethnicities, with religion, with the divergence of groups within groups and individuals whose particular choices can affect all those around them.It seemed the most extraordinary privilege – to have forewarning of a swerve in history, to prepare for how your life would curve around that bend. There is much to be said about the book’s ending, and about how who we are defines what we think. But speaking too openly will only reveal an ending that should be read to be savoured. The recommendation:Recommended for everyone who is a fan of historical fiction/ interested in geopolitical change/ looking for a serious, good read. This book is literary fiction at its finest, not too pretentious or long to bore the reader, and not too glib or arrogant to put one off. Put this on your to-read list right now. **I review Pakistani Fiction, and talk about Pakistani fiction, and want to talk to people who like to talk about fiction (Pakistani and otherwise, take your pick.) To read more reviews or just contact me so you can talk about books, check out my Blog or follow me on Twitter!",1340
"For the first two-thirds of this book it was 5-stars in my head, up there with Home Fire - then the final third just became too convenient, too schematic, too obviously plotted. I could believe that someone present in Nagasaki the day the bomb was dropped could take herself to India to witness the dying days of the Raj, then the Partition and birth of Pakistan. I could even accept that her teenage son should become embroiled in the politics of Afghanistan when the Soviets invade, given his mixed heritage and the way it manifests in his features. But when the same two intertwined families also implicate themselves in post-9/11 Afghanistan, it all becomes a step too contrived - and even more unbelievable given their ages by then an active CIA operative who is 65 working in Afghanistan?.It's a shame Shamsie's judgement fails her towards the end because much of this book is just so good. There are images that are shocking:  the birds-burns on Hiroko's back that char the past into her flesh, the horrific last sight of her father, but also a love and marriage that is deep and nuanced. Shamsie is especially good at writing scenes that are emotive without ever falling into sentimentalism. She also manages the sweep of the book very well: as we move between sections, she fills in the gaps without recourse to clumsy narrative - though, at the same time, there are stories that take place which we never witness. For example, I wanted to know more, much more, about how Hiroko and Sajjad came to Pakistan, lived in a refugee camp, before we pick up their story, years later, in a middle class neighbourhood.I'd say with this book we can see the writer who will emerge so triumphantly in Home Fire coming into being. This novel is still a bit too diffuse, lacking that targeted intensity of the later piece. Still, for the mingling of a family story with politics, this is very good. It's hard to write a female character who is strong and a bit abrasive yet who is also soft and loving, but Shamsie does it brilliantly with Hiroko. Overall, I'd say this is a not-quite-there-yet book, but one which gives a human face to big, global political movements. ",394
"A twisting yarn of a book that struck me as something written fresh on the heels of 9-11. There were certain elements of the plot that I thought were probably even more impactful for readers who read this book a few years after that horrific event. Beginning in Nagasaki, Japan, just before the second nuclear bomb drops, the story ventures to India, Turkey, Pakistan, and New York as it follows two families, one of German-English and another Japanese-Pakistani extraction. Lives mirror and intersect, and Shamsie makes some important observations about class and racial tension. Because this book was recommended to me for my fondness for The Far Pavilions, I expected a grand, sweeping love story. No luck. The romance motif in this book is nothing like Ashok's fairy-tales. Instead the relationships are broken down jalopies, bravely forging ahead on unstable ground. On that negative note, one could also easily compare this novel to The Kite Runner for it's ties to the conflict in Afghanistan. For me, the Kite Runner is more straight-forwardly depressing. This book is much more thoughtful and introspective. Ultimately, what was most interesting to me was the cultural soup of Japanese, German, British, Indian, Pakistani, and Americans that flavored the novel. My general takeaway was that the author wanted to show what happens when people choose to be nice to ""the other"", but still not treat them as equals--those actions have far-reaching, inhumane, humiliating consequences. I also thought that it was interesting to note that author dismisses the idea of using the personal element of a tragedy as the centerpiece of a larger tragedy...Food for thought (Regarding Nagasaki):""You lived it,"" Kim said. ""our father died in it. Your fiance died in it. There's no shame in putting all the weight in the world on that."" It was the wrong answer.Hiroko turned to her, face bright with anger. ""Is that why? That's why Nagasaki was such a monstrous crime? Because it happened to me?"" She pulled the gloves off and threw them at Kim. ""I don't want your hot chocolate,"" she said and stalked away.This book brings up a lot of sediment to sift through. It wasn't always pleasant to read, but it was educational. ",384
